Filename	Reflections	Pixel/Object Changes	Helper Functions	Program Instructions
0a938d79.png	The task involves translating the two single-coloured pixels that are present in the input grid to vertical strips of the same colour in the output grid. Once the two vertical strips are generated, the pattern is repeated in an alternating order, keeping the horizontal distance between the vertical stips the same.	The two distinct coloured pixels in the input grid are converted into vertical strips of the same colour and then repeated multiple times. 	get_objects(): To identify the position and colour of the two pixels that are coloured. get_object_color(): To get the colour of the coloured pixels. empty_grid(): To create the skeleton of the output grid fill_col(): To fill the corresponding column in the output grid with the colour of the pixels identified in the input grid.	1. Use get_objects(grid, by_color=True) to identify the two single-coloured pixels and their coordinates 2. Retrieve the colour of the pixel using get_object_color(obj) 3. Create an empty grid of the same size as the output using empty_grid(row, col) 4. Use fill_col(empty_grid, col_num, value) with the column number as the x-coordinate of the coloured pixel and the value as the colour of the pixel, filling the column from the top of the grid to the bottom 5. Repeat for each colored pixel identified in step 1. 6. Repeat the entire pattern until you reach the end of the grid.
178fcbfb.png	The task is to identify the individual colored pixels in the grid and draw vertical and horizontal lines across the entire grid from those pixels' locations, using the same color as the original pixel.	Colored pixels act as origins for vertical and horizontal lines that span the entire grid in their respective row and column.	get_pixel_coords(grid) to find the coordinates of the individual colored pixels. fill_col(grid, col_num, value) to draw vertical lines for red pixels. fill_row(grid, row_num, value) to draw horizontal lines for pixels of other colors.	1. Use get_pixel_coords(grid) to list all the individual colored pixels and their locations. 2. Iterate over each pixel. If the pixel is red, use fill_col(grid, col_num, 'red') to draw a vertical red line at the pixel's x-coordinate. For pixels of other colors, use fill_row(grid, row_num, value) to draw a horizontal line at the pixel's y-coordinate in the color of the pixel. 3. Ensure that when lines intersect, the color of the horizontal line is applied to the intersecting cell. 4. Repeat this process for each colored pixel in the input to create the pattern in the output grid.
496994bd.png	This task involves constructing a version of the input grid that can be mirrored along the horizontal axis.	There are 1 new object at the lower section of the grid. The new object is a vertically flipped version of the object on the top.	get_objects can be used to obtain the object on the top. vertical_flip can be used to obtain the mirrored object.	1. Obtain the object on the top using get_objects. 2. Obtain a flipped version of the object using vertical_flip. 3. Fill the flipped object at the lower section of the grid.
c9e6f938.png	The task creates a mirrored version of the input grid and appending it to the right side of the original, effectively doubling the width of the grid.	Each input grid is mirrored along its vertical axis and joined to the right, resulting in a grid that is twice as wide with a symmetrical pattern.	horizontal_flip: To create a mirrored copy of the input grid.\ncombine_object: To place the original and mirrored grids next to each other, effectively doubling the width of the original grid.	1. Use the `horizontal_flip` function to create a horizontally mirrored copy of the input grid.\n2. Combine the original grid with the flipped grid side by side to create the output grid.
1f0c79e5.png	The task entails identifying a square in the input grid that consists of one or more shared vertex of red colour. The goal is to extend two adjacent sides of this square from the red vertex, creating a pattern that extends diagonally across the grid from the position of the red vertex.	The important objects in this case are the coloured squares containing one or more red vertex. The sides of the squares adjacent to the red vertex are extended diagonally across the grid.	get_objects(): To detect squares. get_pixel_coords(): To find the specific coordinates of the red colour that serves as a vertex for the extension. fill_between_coords(): To fill in the cells diagonally between two coordinates.	1. Use `get_objects(grid, multicolor=True)` to detect all squares consisting of two colours. 2. Within each detected object, use get_pixel_coords() to find the red vertex. 3. Determine the coordinates to which you will extend from the red vertex. In this case, it is the edge of the grid. 4. Use fill_between_coords(grid, coord_1, coord_2, value) to fill in the cells diagonally from the red vertex. 5. If there are multiple red vertices within a square or multiple squares, repeat steps 2 to 4 for each vertex.
e98196ab.png	The task involves splitting the input grid by a grey line and then combining the two halves, prioritizing colored pixels over black pixels.	The input is divided along a grey line, resulting in two halves. These halves are then merged such that when one half has a colored pixel at any position, it is preferred over a black pixel at the same position in the other half.	get_pixel_coords: To identify the coordinates of the grey dividing line.\ncrop_grid: To separate the input into two halves at the grey line.\ncombine_object: To overlay one half over the other, ensuring colored pixels take precedence over black pixels.	1. Identify the grey line that divides the input into two halves.\n2. Create a function to overlay one half over the other, giving priority to colored pixels over black pixels.\n3. Merge the halves according to the priority rule to form the output.
63613498.png	The task involves identifying an object of the same shape and recoloring it.	The output grid is very similar to the input but one object recolored. The object on the top left corner surrounded by '5' is the query. Another object of the same shape, not necessarily the same color, is recolored as '5'.  	get_objects can be used to get all the objects. change_object_color can be used to change the color of the matched object.	1. Use get_objects to get all the objects. 2. Identify the query object on the top left corner. 3. Loop through all other object and check if the object has the same shape as the query object. 4. Recolor objects that match as '5' using change_object_color.
c3f564a4.png	The task involves filling in the black squares within a colorful patterned grid by extending the colors adjacent to these black squares.	The black squares in the input are transformed in the output by filling them with the color of the nearest non-black pixel from the top-right direction.	get_pixel_coords: To find the coordinates of all black pixels.\nfill_value: To change the color of the black pixels to the color of the nearest colored pixel from the top-right direction.	1. Use `get_pixel_coords` to locate all black pixels.\n2. For each black pixel, search in the top-right direction to find the nearest colored pixel.\n3. Use `fill_value` to fill each black pixel with the color of the identified nearest colored pixel.
56dc2b01.png	This task involves positioning a pattern to a line and sandwiching it with a new line.	The object of '3' is moved to the closet position where it is touching the '2' line. A new '8' line is added to the opposite side of the object such that the '3' object is sandwiched between the two lines.	get_objects can be used to get the '3' item and the '2' line. fill_between_coords can be used to draw the new '8' line.	1. Get all objects using get_objects. 2. Identify the location of the '2' line and calculate the new position of the '3' object. 3. Move the '3' object to the new position. 4. Calculate the position of the new '8' line such that the '3' object will be sandwiched. 5. Draw the new line using fill_between_coords
253bf280.png	The task requires connecting all grey pixels with either a horizontal or vertical green line if they align on the same row or column, respectively. If the grey pixels cannot be connected because they do not align, no line is drawn. 	Grey pixels are replaced with green pixels to form a line if they align horizontally or vertically. The line is continuous and spans the full distance between the outermost grey pixels in the alignment.	get_pixel_coords(grid) to get the coordinates of grey pixels. fill_row(grid, row_num, value) to draw a horizontal green line. fill_col(grid, col_num, value) to draw a vertical green line.	1. Use get_pixel_coords(grid) to identify the positions of grey pixels. 2. Determine if the grey pixels align on the same row or column. 3. If they align horizontally, use fill_row(grid, row_num, 'green') to draw a horizontal green line connecting them. If they align vertically, use fill_col(grid, col_num, 'green') to draw a vertical green line connecting them. 4. Ensure that no lines are drawn for grey pixels that do not align on the same row or column.
539a4f51.png	This task create layers of repeating colors along the diagonal line to the bottom right.	The output grid is double in both width and height of the input grid. The empty pixels are layered with colors of the grid along the diagonal line from the top left to the bottom right. The empty pixels from the input grid are not choosen as the color for layering, but instead the pattern repeats again.	fill_row and fill_col can be used to layer the colors. empty_grid can be used to create a output grid that is double in both width and height of the input grid.	1. Create a output grid that is that is double in both width and height of the input grid using empty_grid. 2. Copy the input grid to the same location of the output grid. 3. For each layer along the diagonal line that is not filled, fill in a single layer colors using the colors from the top left corner, then iterate to the next color along a diagonal line from the top left corner to the bottom right, and fill in the next layer.
23b5c85d.png	 The task involves identifying all the colored squares and rectangles in the input grid and finding the one with the smallest area. The output is a grid that only contains this smallest colored shape.	 The smallest colored shape is identified, and all other shapes are discarded. No other changes are made to the smallest shape; it retains its color and size.	get_objects(grid, by_color=True) to identify colored shapes.	1. Use `get_objects(grid, by_color=True)` to identify all the separate colored shapes on the grid. 2. Determine the area (number of pixels) of each identified shape. 3. Find the shape with the smallest area.
5ad4f10b.png	This is a denoising task that involves identifying the color of the noise and also the object without the noise.	There is one large object of unique color with noise of another color scattered. The output grid contains the large object scaled down to the smallest possible size, and with the color replaced with the color of the noise.	get_objects can be used to get the large object and also the noise. empty_grid can be used to create the output grid of the size of the output object. change_object_color can be used to change the color of the output object to the color of the noise.	1. Get all objects using get_objects. 2. Identify the large object, and the color of the noise. 3. Calculate the smallest possible size the large object can shrink to. 4. Shrink the large object. 5. Replace the color of the object to the color of the noise using change_object_color. 6. Create an empty_grid that can just contain the output object using empty_grid. 7. Place the output object into the output grid.
e9614598.png	The task involves adding a fixed-sized green '+' symbol between two blue pixels in a grid, where the center of the '+' is equidistant from both blue pixels.	In each grid, two blue pixels are located, and a green '+' made of five pixels is added centrally between them. The '+' sign's central pixel is positioned exactly in the middle of the two blue pixels, with the remaining four pixels of the '+' spreading out vertically and horizontally from this central point.	get_pixel_coords: To identify the coordinates of the blue pixels.\nfill_value: To fill in the green '+' symbol at the calculated midpoint.	1. Identify the coordinates of the two blue pixels.\n2. Calculate the midpoint between these two blue pixels.\n3. Plot a green '+' shape at this midpoint, ensuring it is composed of one central pixel and four adjacent pixels (above, below, left, and right of the center).
5582e5ca.png	This task involves filling the grid with the most common color in the input grid.	The color of the entire grid is filled with a single color. The new color would be the most common color in the input grid.	get_pixel_coords can be used to identify the most common color. fill_rect can be used to fill the entire grid with the most common color.	1. Identify the most common color using get_pixel_coords. 2. Fill the entire grid with the most common color using fill_rect.
8731374e.png	The task involves identifying the largest block of some color having a few different colored pixels inside it and then extending those pixels across the height and width of the block.	The object is the largest block of some color. Pixels of same color as the original ones are added to the existing pixels across the height and width of the block.	get_objects can be used to identify the largest block and then the pixels inside it. get_pixel_coords can be used to get the value and coordinates of the pixels. fill_between_coords can be used to extend the pixels across the height and width of that block.	1. get the object 2. get the pixels 3. extend the pixels vertically and horizontally to cover the height and width of the block.
1f876c06.png	The logic of the problem requires finding pairs of the same-colored pixels and then connecting them with a diagonal line of the same color. The diagonal connection starts from the first pixel and ends at the second pixel, creating a continuous path if there are multiple pairs of the same color.	Important objects: Pairs of pixels of the same color. Changes: Connecting the pairs of pixels diagonally to form a continuous path.	get_pixel_coords(grid): To identify the coordinates of the colored pixels. fill_between_coords(grid, coord_1, coord_2, value): To fill in the diagonal path between two coordinates with the specific value (color).	1. Use get_pixel_coords(grid) to get all the coordinates of colored pixels. 2. Group these coordinates by color to identify pairs or sets belonging to the same color. 3. For each color group:      1. Sort the pixels in the group based on their coordinates to determine the sequence of connection.      2. Use fill_between_coords(grid, coord_1, coord_2, value) to connect the pixels diagonally in the sorted order. 4. After connecting all pixels within the same color, you should have a grid with diagonal lines of colors connecting the pairs of pixels.
4522001f.png	The task involves identifiy which corner is the object located on a 3x3 grid. The output would be a 9x9 grid that contains two diagonally touching 4x4 square of value '3'. The position of the 2 squares depends on the object touching corner in the input grid, with one of the square corner touching the same corner as the input, and the other square touching the opposite corner of the previous square.	The input grid is discarded. A 9x9 grid with 2 4x4 squares of value '3' is returned. The position of the squares is dependent of the input grid.	get_objects can be used to obtain the location of the object in the input grid. empty grid can be used to create a 9x9 grid. fill_between_coords can be used to create the 2 4x4 squares.	1. Check which grid corner the input object is touching. 2. Create a 9x9 output grid. 3. Fill a 4x4 square of value '3' at the same corner using fill_between_coords. 4. Fill another 4x4 square of value '3' that is touching the opposite corner of the previous square. The squares should touching diagonally only by the corners.
4c5c2cf0.png	This task involves contructing a symmetrical pattern around a central pattern.	There are 3 new objects that are flipped versions of an object around an object of a flower pattern with a different color. The new pattern has a vertical and horizontal symmtery along central flower object.	get_objects can be used to obtain the '2' value object. horizontal_flip and vertical_flip can be used to obtain mirror images of the original pattern. 	1. Obtain all objects using get_objects. 2. Identify the pattern that has to be flipped horizontally and vertically. 3. Obtain 3 flipped versions of the pattern using horizontal_flip and vertical_flip. 4. Fill the flipped patterns at the appropriate location.
d06dbe63.png	"The transformation process consists of creating a pattern that extends from an initial light blue pixel in two opposite directions, each direction in a ""staircase"" fashion: up and right, and down and left. Each ""stair"" consists of two pixels added in one direction and then two pixels in the perpendicular direction."	The input features a single light blue pixel. From this pixel, the output extends a snake-like pattern that alternates directions. Each segment of the snake is two pixels long, creating an alternating pattern of vertical and horizontal pairs of pixels extending from the initial light blue pixel.	get_pixel_coords: To find the initial light blue pixel's location.\nfill_value: To color the pixels in the pattern based on the current direction of the path.	1. Locate the light blue pixel in the input grid using `get_pixel_coords`.\n2. Starting from the light blue pixel, apply the following pattern:\n   - Add two pixels above the current pixel, then two pixels to the right of the last added pixel.\n   - From the initial light blue pixel, add two pixels below, then two pixels to the left of the last added pixel.\n   - Repeat this pattern, alternating between vertical and horizontal additions, until the edges of the grid are reached.\n3. Use `fill_value` to color the new pixels in the path formation.\n4. Create a recursive or iterative function that applies these steps, handling grid boundaries to prevent out-of-bounds errors.
673ef223.png	The task involves extending pixels to a line and also copying a similar pattern to another location	A line is draw from each '8' pixel to the red line at the same horizontal level. The '8' pixel is recolored to a '4'. For the other red line, horizontal lines of '8' to the grid border are drawn at the same relative position of the previous red line.	get_objects can be used to obtain all '8' pixels and also the red lines. fill_row can be used to draw the horizontal '8' lines. fill_value can be used to recolor the original '8' pixels.	1. Use get_objects to get all '8' pixels. 2. Identify the direction of the red line at the same horizontal level of the '8' pixels. 3. For each '8' pixel, draw a '8' line from the pixels to the red line. 4. Recolor the original '8' pixels to '4'. 5. For each original '8' pixel, draw another '8' line at the same relative vertical position at other red line that extends to the grid border horizontally. 
32597951.png	The task involves detecting a specific pattern—a light blue rectangle containing dark blue pixels—and then changing those dark blue pixels to green while leaving the rest of the grid unchanged.	Important objects: The light blue rectangle and the dark blue pixels within it. Changes: Convert dark blue pixels within the light blue rectangle to green.	get_objects(grid, by_color=False, more_info=True): To identify the light blue rectangle and dark blue pixels. change_object_color(obj, value): To change the color of the dark blue pixels to green.	1. Use `get_objects(grid, by_color=False, more_info=True)` to identify all light blue rectangles and dark blue pixels. Note that the rectangle is characterized by light blue pixels, and the pixels we want to change are dark blue. 2. For each light blue rectangle:     1. Identify the dark blue pixels within the rectangle's bounds.     2. Apply `change_object_color(obj, value)` for each dark blue pixel found in step 2, changing their color to green.
dc1df850.png	The task involves encircling each red pixel with eight blue pixels, forming a blue perimeter around each red pixel.	The transformation consists of locating each red pixel in the input grid and adding blue pixels around it in all eight possible directions (above, below, left, right, and diagonally in all four corners), ensuring the red pixel is centrally surrounded by these blue pixels. If multiple red pixels are adjacent, the blue pixels are shared between the perimeters of these red pixels.	get_pixel_coords: To get the coordinates of red pixels.\nfill_value: To place blue pixels around each red pixel.	1. Use `get_pixel_coords` to identify the coordinates of all red pixels in the grid.\n2. For each red pixel identified, add blue pixels in all eight positions around it (one on each side and one on each diagonal).\n3. If a blue pixel would overlap with an existing red pixel, it should not be placed.\n4. Return the modified grid with red pixels surrounded by blue.
98cf29f8.png	The task involves combining two objects based on which object forms the connection and make it adjacent to the main object.	There is a main object that is a rectangle. The other object is also a rectangle but with an extended row or column connecting it to the main object. The sizes of the objects remain the same.	get_objects can be used to get the objects.	1. obtain the objects and identify which object is the main and which is forming the connection. 2. move the connecting object adjacent to the main object.
e76a88a6.png	The task requires identifying colored squares and filling corresponding grey squares with that color.	The colored square in each input grid serves as a template for the color that should be used to fill the grey squares in the grid. All grey squares are filled with the color of the identified colored square, transforming the grid into a pattern of colored squares where grey squares previously existed.	get_pixel_coords: To identify the coordinates of the colored and grey pixels.\nget_object_color: To obtain the color of the colored square.\nchange_object_color: To change the color of grey squares to the identified color.	1. Use `get_pixel_coords` to locate the coordinates of the colored square(s).\n2. Identify the color of the square(s) using `get_object_color`.\n3. Use `get_pixel_coords` again to locate all grey squares.\n4. Fill all grey squares with the identified color from step 2 using `change_object_color`.\n5. Return the grid with the grey squares now filled with the new color.
3af2c5a8.png	The ARC task requires creating a reflection of the input grid in both horizontal and vertical axes to form a larger grid with a repeated pattern.	The input grid is mirrored horizontally to create a horizontal reflection. The horizontally reflected grid is then mirrored vertically to create a vertical reflection. These mirrored versions are combined to form the output grid.	horizontal_flip(grid): To get the horizontal flip vertical_flip(grid): To get the vertical flip combine_object(obj_1, obj_2): To combine the images	1. Take the input grid and create a horizontal mirror image using horizontal_flip(grid). 2. Combine the original grid with the horizontal flipped grid using combine_object(obj_1, obj_2). 3. Take the combined grid from step 2 and create a vertical mirror image using vertical_flip(grid). 4. Combine the vertically flipped grid from step 3 with the grid before flipping to get the final output grid using combine_object(obj_1, obj_2) again.
c8f0f002.png	This task replaces orange pixels in the input with dark grey in the output, while maintaining the positioning of all other colored pixels.	The transformation includes changing orange pixels to dark grey while keeping the blue pixels and the position of the other colored pixels unchanged.	get_pixel_coords: To locate all orange pixels on the grid.\nchange_object_color: To change the color of the identified orange pixels to dark grey.	1. Identify the coordinates of the orange pixels using the `get_pixel_coords` function.\n2. Change the color of the identified orange pixels to dark grey using the `change_object_color` function.\n3. Ensure all other pixels remain the same by not applying any changes to them.
d43fd935.png	The task transforms an input grid by drawing vertical or horizontal lines connecting isolated colored pixels to the main 2x2 block of the same color, provided they share an x or y coordinate with any pixel of the block.	For each input-output pair, the process locates a 2x2 block of a solid color and identifies any stray pixels of the same color that lie on the same row or column as the block. These stray pixels are then connected to the block by drawing a continuous line of the same color towards the block, stopping either at the block or just before it if another colored pixel is encountered.	get_pixel_coords: To identify the pixels in the top row that need to be replicated downward.\nfill_col: To fill each column downward from the colored pixels found in the top row.	1. Locate the 2x2 block within the grid.\n2. For each colored pixel not in the block, check if it shares an x or y coordinate with any of the block's pixels.\n3. If it does, draw a line from that pixel to the edge of the block in the pixel's color.\n4. Ensure that the line does not overwrite any other colored pixels.
